name,price,status,shipping,free_returns,items_sold
Lonabr Modern Office Chair Middle Back Adjustable Height Swivel PU Upholstered,24999,Brand New,0,False,
Beige Ergonomic Office Chair Fabric Padded Armless Home Game Chairs Mid Back US,11745,Brand New,0,True,51
High Back Leather Office Chair Executive Office Desk Task Computer Chair ,11599,Brand New,0,False,2718
Video Gaming Racing Chair Ergonomic Swivel Leather Computer Desk Office Chair,6999,Brand New,0,True,488
 Herman Miller Aeron Chair Open Box Size B Fully Loaded  ( Black Chair ) ,54911,New – Open box,0,True,10000
"Steelcase Leap V2 Chair, Fully Loaded Black on Black ",33911,Refurbished,0,True,4256
Leather Video Gaming Racing Chair Ergonomic Swivel Computer Office Desk Chair ,6959,Brand New,0,False,168
"Steelcase Leap V2 Chair,   Fully Loaded Platinum Edition",34411,New – Open box,0,True,811
Gaming Chair Ergonomic Recliner Office Computer Desk Seat Swivel Footrest,12959,Brand New,0,False,46
Ergonomic Gaming Chair Swivel Leather Executive Computer Office USA,5695,Brand New,0,True,33
 Herman Miller Fully Loaded Posture fit Size B Aeron Chairs  - Open Box -,58911,New – Open box,0,True,7944
Steelcase Amia Chair by Steelcase  (leap) Open Box,27411,New – Open box,0,True,622
Steelcase Gesture Desk Chair - Black Fabric  Fully Adjustable-Open BOX,54911,New – Open box,0,True,2640
Computer Gaming Chair Ergonomic Office Chairs Executive Swivel Racing Recliner,9959,Brand New,0,False,
"YSSOA Gaming Office Chair High Back Computer Ergonomic Chair,Headrest & Footrest",9299,Brand New,0,True,
Ergonomic Computer Gaming Chair Office Chair Recliner Racing Swivel Seat Black,15900,Brand New,0,True,
Ergonomic Gaming Chair Executive Desk Recliner Computer Seat Swivel Office Chair,7599,Brand New,0,True,344
Office Computer Desk Executive Chair Task Swivel Mesh Chair Adjustable Height ,5399,Brand New,0,False,1504
Herman Miller Mirra Chair  - Fully Adjustable Features - Graphite Frame (aeron) ,32911,New – Open box,0,True,713
Mesh Office Chairs Ergonomic Desk Chair Computer Mid Back Task Chair with Wheels,5299,Brand New,0,False,206
Gaming Chair Racing Computer Office Chair PU High Back Footrest Ergonomic Black,15499,Brand New,0,False,
"Steelcase Leap  V1  Chair, -Open Box- Fully Loaded Black Fabric",22911,Refurbished,0,True,762
New Headrest for Herman Miller classic and remastered Aeron office Chair Black,8999,Brand New,0,False,226
Steelcase Gesture Ergonomic Office Chair| Fully Functional,59900,Pre-Owned,0,False,28
Executive Gaming Chair Massage Reclining Swivel Office Chair Desk Computer,10999,Brand New,0,True,374
Ergonomic High Back Mesh Office Chair Adjustable Computer Desk Task Chair Swivel,7900,Brand New,0,True,
ZYBRTEK Ergonomic Office Gaming Computer Chair Adjustable Reclining Footrest USA,9900,Brand New,0,True,
Gaming Chair Office Racing Computer Desk Seat Recliner Footrest Swivel Vibration,12999,Brand New,0,False,
Ergonomic Gaming Racing Chair Computer Office Desk Seat Swivel Recliner Footrest,15890,Brand New,0,True,525
"Razer Iskur X Ergonomic Gaming Chair: Ergonomically, 2D Armrests, Black/Green",22888,Pre-Owned,0,False,18
Office Computer Chair High Back PU Leather Ergonomic Executive Task Desk Chairs,12076,Brand New,0,False,
Leather Gaming Racing Chair Ergonomic Executive Office Computer Desk Chair ,6999,Brand New,0,True,234
Herman Miller Celle Chair Fully Loaded,32999,Refurbished,0,False,348
Soft Leather Office Ergonomic Executive Desk Chair Swivel Computer Chair gaming,11499,Brand New,0,True,571
PU Leather High Back Executive Office Chair Ergonomic Computer Executive Swivel,7599,Brand New,0,False,1361
Gaming Chair Massage Reclining Swivel Office Chair Desk Computer Ergonomic,12699,Brand New,0,True,39
Mesh Home Office Chair Ergonomic High Back Computer Desk Task Chair Swivel Seat,6999,Brand New,2699,True,238
"Steelcase Leap V2 Chair,  -Open Box- Fully Loaded Black Fabric ",36411,New – Open box,0,True,924
High Back Ergonomic Office Chair Executive Mesh Desk Chair Lumbar Support Tilt,8900,Brand New,0,True,
Office Leather Ergonomic Racing Desk Chair Swivel Computer Chair Gaming Chair,7899,Brand New,0,True,783
Computer Gaming Racing Chair Ergonomic Office Desk Chairs Swivel Faux Leather,6500,Brand New,0,False,16
"gaming chair,   Blue and black.  Needs piston.  ",3000,Pre-Owned,,False,
Ergonomic Gaming Chair Leather Executive Computer Office Desk Chair Swivel ,6999,Brand New,0,True,104
East Oak Ergonomic High Back Mesh Swivel Office Chair (Black),8499,Brand New,0,False,
Humanscale Freedom Task Chair with Headrest; Black; Standard Arms,42000,Pre-Owned,,False,53
Ergonomic High Back Mesh Office Chair Adjustable Computer Desk Task Chair Swivel,4799,Brand New,0,False,27
Ergonomic Mesh Office Chair Foldable Executive Desk Computer Swivel Task Chair ,7899,Brand New,0,False,44
"Nightingale CXO 6200D Memory Foam, Mesh, headrest , Lumbar Support Office Chair ",39000,Pre-Owned,12999,False,254
Executive Office Desk Chair Computer Racing Gaming Chair Ergonomic Swivel Chair,7099,Brand New,0,True,140
Herman Miller Aeron Chair Mesh Headrest New  Fits A B C Size,9897,Brand New,0,False,
Fabric Recliner Chair Single Modern Sofa Home Theater Seating for Living Room,14999,Brand New,0,False,660
New Listing1994 Office Swivel Chair by Arne Jacobsen for Fritz Hansen - Model 3117 ,30000,Pre-Owned,,False,
Herman Miller Aeron Mesh Office Desk Chair Medium Size B fully adjustable lumbar,49897,Refurbished,9900,True,885
Massage Reclining Swivel Office Chair Desk Computer Gaming Chair w / Footrest,14699,Brand New,0,True,
Ergonomic Office Gaming Chair Racing Computer PU Swivel Massage Footrest Blue,11999,Brand New,0,False,
Ergonomic Executive Mesh Office Chair Swivel with Headrest Armrest Computer Desk,8999,Brand New,0,True,
"Mid-Back Mesh Adjustable Ergonomic Computer Chair, Gray",3799,Brand New,0,False,20
Hoffree bluetooth Massage Gaming Chair w/Speaker Office Computer Racing Footrest,13599,Brand New,0,True,
Computer Gaming Chair Swivel High-back Ergonomic Chairs Executive Recliner Seat,8133,Brand New,0,False,
Ergonomic Gaming Racing Chair Leather Office Chair Swivel Computer Desk Seat,8959,Brand New,0,True,
Ergonomic Gaming Racing Chair Swivel Office Desk Computer Video Game Chair ,7899,Brand New,0,True,199
Herman Miller X Logitech G Embody Gaming Chair ,129911,Brand New,0,True,144
PU Leather Executive Office Chair Ergonomic Computer Swivel Chair,8999,Brand New,0,False,
Herman Miller Aeron Remastered - Size B Graphite -open box - Highly Adjustable,64911,New – Open box,0,True,334
PU Leather Racing Gaming Chair Ergonomic Swivel Computer Office Chair,9900,Brand New,0,False,
Leather Video Gaming Chair Ergonomic Computer Swivel Office Desk Task Chair,5599,Brand New,999,True,
Mid Back Mesh Task[CHAIR+PROTECTIVE FLOOR MAT]Office Clerk Computer PC Desk Seat,5699,Brand New,0,True,77
Recliner Chairs Single Modern Reclining Sofas Home Theater Seating Club Chairs,14899,Brand New,0,False,971
Herman Miller Aeron Chair - Size B  Mineral Open Box,99911,New – Open box,0,True,86
"Plush Velvet Office Chair, Pearl Blush",5414,Brand New,0,True,
Mesh Chair Ergonomic Executive Swivel Office Chair Computer Desk Black,8590,Brand New,0,True,1377
Ergonomic Mid Back Office Computer Desk Chair PU Leather Swivel Executive Chair,7792,Brand New,0,False,
Ergonomic Office Chair High Back Swivel Executive Computer Desk Seat Mesh Task,8900,Brand New,0,True,
"YSSOA Gaming Office High Back Computer Ergonomic Chair,with Headrest & Footrest",9599,Brand New,0,True,54
Kneeling Chair Home Office Ergonomic Computer Desk Wood Stool For Active Sitting,5399,Brand New,500,True,
CLATINA Office Gaming Chair Executive Mid Back Ergonomic Adjustable PU Swivel,6999,Brand New,0,True,
High Back Leather Office Chair Executive Office Desk Task Computer Desktop Chair,9699,Brand New,0,True,
Steelcase Leap V2 in Titanium Color Frame ,42499,New – Open box,0,False,
Executive Office Computer Desk Chair w/High Back 6-Point Vibration Massagers,20499,Brand New,0,False,
"Plush Velvet Office Chair, Pearl Blush",5414,Brand New,0,True,
Ergonomic Mid Back Office Computer Desk Chair PU Leather Swivel Executive Chair,7792,Brand New,0,False,
New ListingMid-Back Mesh Adjustable Ergonomic Desk Chair Computer Chair Mesh Office Chairs,4770,Brand New,0,False,
Executive Mesh Office Task Chair Foldable Ergonomic Computer Desk Chair Swivel,4799,Brand New,0,False,
Goplus Massage Gaming Chair Reclining Swivel Racing Chair w/ Lumbar Support Gray,9699,Brand New,0,False,16
Mesh Chair High Office Chair Home Ergonomic Computer Task Desk Seat,4749,Brand New,0,True,
Adjustable Office Executive Desk Chair Ergonomic Swivel Conference Chair Leather,5899,Brand New,0,False,
HOFFREE 7Point Massage Office Chair Executive Gaming Computer Leather w/Footrest,16719,Brand New,0,True,
Upholstered Velvet Button Tufted Backrest High Back Ottoman Accent Chair Living ,12999,Brand New,0,False,
"Mid-Back Mesh Adjustable Ergonomic Computer Chair, Gray",3988,Brand New,0,False,
Manon Blue & White Floral Print Fabric Club Chair,22999,Brand New,0,False,
Mesh Office Chair Ergonomic Black Mid Back Computer Desk Chair,1999,Refurbished,10825,False,65
Office Leather Ergonomic Executive Desk Chair Swivel Computer Chair Gaming Chair,6999,Brand New,0,True,88
PU Leather Recliner Chair Living Room Single Sofa Home Theater Seating Brown,15499,Brand New,0,False,807
Knoll Re-Generation Ergonomic Office Chair  all black  ,24911,New – Open box,0,True,223
Exectuive High Back Chair Managerial Home Desk Office Chair with Lumbar Support,9475,Brand New,0,False,
HOFFREE Leather Massage Office Chair Executive Gaming Computer Chair Footrest,16299,Brand New,1938,False,177
Herman Miller Aeron Remastered - Size B Graphite -open box - Highly Adjustable,64911,New – Open box,0,True,334
Hoffree Gaming Chair Massage Ergonomic Office Computer Racing Lumbar PU Footrest,3599,Brand New,0,True,
Herman Miller  Embody Office Chair - Grey  Fabric   BRAND NEW,105000,Brand New,0,True,76
Home Office Chair Mesh Executive Task Chair Swivel Computer Desk Chair Headrest,8299,Brand New,0,True,
Herman Miller Aeron Remastered Chair - Size B Graphite -open box -,89911,New – Open box,0,True,263
Ergonomic Gaming Chair Bluetooth Speakers Footrest Office Massage Swivel Chair,27999,Brand New,0,True,
Computer Chair Mesh Swivel Home Office Desk Chair w/ Wheel Mid-Back Task Chair,4559,Brand New,0,False,52
Ergonomic Mesh Tall Drafting Chair Office Lumbar Support Adjustable Foot Ring,8599,Brand New,0,True,
Office Gaming Chair Computer Racing PU Executive Vibration Seat Swivel Blue,11999,Brand New,0,True,
Ergonomic Gaming Racing Chair Computer Office Desk Seat Swivel Recliner Footrest,15900,Brand New,0,True,21
Black Leather Executive [CHAIR+PROTECTION CARPET] Manager Highback Computer Seat,10599,Brand New,0,True,
Gaming Chair Office Racing Computer Desk Seat Recliner Footrest Swivel Vibration,10899,Brand New,0,False,11
EXECUTIVE CHAIR by HAWORTH ZODY in Black COLOR LOADED CHAIR* desk mesh chair,25997,Refurbished,0,False,
Power Lift Massage Recliner Chair for Elderly Heated fabric Recliner Ergonomic,38999,Brand New,0,False,83
"Steelcase Leap V2 Chair,   Fully Loaded ",34911,Refurbished,0,True,207
Ergonomic Reclining Massage Office Computer Chair Adjustable Swivel Gaming Chair,12999,Brand New,0,True,99
"X Rocker Play 2.0 Floor Rocker Gaming Chair, Black/Red",5599,Brand New,0,False,
"Linen Manual Recliner Armchair w/Two Cup Holders, Footrest for Living Room Black",25999,Brand New,0,False,
Executive Mesh Office Task Chair Foldable Ergonomic Computer Desk Chair Swivel,8599,Brand New,0,True,
Herman Miller Aeron Remastered Chair - Size C  Graphite  -open box -,89911,New – Open box,0,True,311
Home Office Velvet Chair Mid Back Swivel Executive Task Desk Seat Vanity Chair ,5699,Brand New,0,False,
X Rocker SE 2.1 Black Leather Video Gaming Chair Includes Ergonomic Back Support,25285,Brand New,0,False,12
VEVOR Ergonomic Kneeling Chair bentwood Stool Strengthen Muscles Furniture White,7659,Brand New,0,True,
Chair Tilt Control Mechanism Swivel Base Plate Mounting Hole Office Indoor Home,2239,Brand New,0,True,
Replacement Office Chair Adjustable and T-Arm Pad Armrest Top Cap 1 Pair (2pc),1695,Brand New,0,False,817
Home Office Mesh Chair Ergonomic High Back Computer Desk Task Swivel Chair,4900,Brand New,0,False,14
Gaming Chair Racing High Back Office Computer Desk Seat Recliner Footrest Swivel,15199,Brand New,0,True,
White Office Chair High back Computer Racing Gaming Chair Ergonomic Chair,5999,Brand New,0,False,
Swivel Xtreme Swivel Chair with Footrest,9151,Brand New,0,False,
"Aloudy Ergonomic Memory Foam Office Chair Armrest Pads, Comfy Gaming 2 per Pack",1349,Brand New,0,False,
Set of 4 Adjustable Modern Swivel Bar Stools Dining Chair Counter Height  Black,15758,Brand New,0,True,
Adjustable Executive Office Chair Study Computer Chair Task Desk Swivel Mid Back,6299,Brand New,0,False,7
Mid-Century Accent Chair Reading Armchair Upholstered Single Lounge Sofa 2 Color,10999,Brand New,0,True,7
"Adjustable Faux Leather Swivel Office Chair, Black",5984,Brand New,0,False,
Amia  Chair by Steelcase - open box ,32911,New – Open box,0,True,353
"Office Chair with Matching Color Casters, Adjustable, Bonded Leather Upholstery",4543,Brand New,0,True,
Leather Gaming Chair Swivel Computer Desk Chair Ergonomic Executive Office Chair,6799,Brand New,0,False,
"AKRacing Core Series EX Gaming Chair, Black/Blue ",17000,New – Open box,0,False,
Black PU Leather High Back Office Chair Executive Ergonomic Computer Desk Swivel,10799,Brand New,0,True,374
Lumbar Back Support Pad Size B Black For Herman Miller Aeron Chair,1700,Brand New,0,True,457
Ergonomic Gaming Chair Leather Executive Computer Office Desk Chair Swivel,6364,Brand New,0,True,
Freedom Chair by Humanscale -OPEN BOX ,34911,New – Open box,0,True,352
NRG INNOVATIONS RSC-G100BL BLUE ADJUSTABLE OFFICE COMPUTER DESK GAMING CHAIR,11999,Brand New,0,True,
New Herman miller Aeron chair Pneumatic Cylinder New Part #1B08VM SHS,5399,Brand New,0,False,283
Computer Gaming Racing Chair Ergonomic Office Desk Chairs Swivel Faux Leather,6274,Brand New,0,False,
Home Office Mesh Chair Ergonomic High Back Computer Desk Task Swivel Chair 250lb,4799,Brand New,0,False,
"Office Computer High Back Adjustable Ergonomic Desk Chair Executive PU,White",8999,Brand New,0,False,
Herman Miller Celle Chair Fully Loaded,13890,Brand New,0,False,18
High Back Home Office Desk Chair Ergonomic Swivel Task Chair Gaming Chair Black,10496,Brand New,0,True,130
"Melaluxe Office Chair Cover - Universal Stretch Desk Cover , Black , Large New",1548,Brand New,0,False,37
Steelcase Amia Office Chair,19900,Pre-Owned,9900,False,
Adjustable Height Upholstered Headrest for Chair Series Ergonomic High Swivel,3299,Brand New,0,True,56
Milan Outdoor Folding Wood Adirondack Chair,5736,Brand New,0,False,
"Akron Gaming Office Chair with Faux Leather, Red",5900,Brand New,0,False,
Milan Outdoor Folding Wood Adirondack Chair,5736,Brand New,0,False,
Mason Mid-Century Modern Button Tufted Fabric Recliner,15321,Brand New,0,False,
Ergonomic Office Chair Rocking Mesh Chair Racing Swivel Computer Seat Desk Task,6500,Brand New,0,True,29
Ergonomic Kneeling Chair Office Home Stool Rocking Chair Knee Stool Body Shaping,6199,Brand New,0,True,
Adjustable Height Upholstered Headrest for Chair Series Ergonomic High Swivel,3299,Brand New,0,True,56
Home Office Mesh Chair Ergonomic High Back Computer Desk Task Swivel Chair,4900,Brand New,0,False,14
Computer Gaming Racing Chair Ergonomic Office Desk Chairs Swivel Faux Leather,6274,Brand New,0,False,
Luxury Rosewood Classic Eames Lounge Chair Ottoman Genuine Leather standard,71250,Open Box,0,False,8
Adjustable Height Computer Desk Chair Executive Task Home Swivel Office Chair,5598,Brand New,2299,True,240
"Flexispot Back Support Ergonomic Office Chair, Model: OC13, Color: Grey",10999,Brand New,0,False,
New ListingMesh Office Chair Ergonomic Desk Chair Computer Chair Adjustable Arm Swive Chair,4999,Brand New,0,False,
"AKRacing Core Series EX Gaming Chair, Black/Blue ",17000,New – Open box,0,False,
"New ListingAdjustable Swivel Artificial Leather Gaming Chair, Black",6899,Brand New,0,True,
ELECWISH Ergonomic Office Chair High Back Mesh Office Desk Chair Home Office,7900,Brand New,0,False,
USED Dining Parson Chair Set of 2 Armless Kitchen Room Brown Leather Backrest ,5858,Pre-Owned,0,False,
"Akron Gaming Office Chair with Faux Leather, Red",5900,Brand New,0,False,
Red Akron Gaming Office Chair with Faux Leather Adjustable High Back Task Chair,7934,Brand New,0,True,
Portable Telescopic Stool Foldable Camping Hiking Chair Collapsible Seat Fishing,1899,Brand New,0,False,
Gaming Chair Ergonomic Office Computer Racing Lumbar Massage Recliner Swivel PU,11999,Brand New,0,False,
Executive Office Chair Height Adjustable Desk Chair w Recline Massage & Footrest,16399,Brand New,0,True,66
"New ListingYSSOA Ergonomic Mesh Computer Chair,Arms & Lumbar Support Study Chair Muti-Color",5699,Brand New,0,True,
Electric Power Lift Recliner Chair Sofa with Massage and Heat for Elderly Remote,47999,Brand New,0,True,71
Office Computer Desk Executive Chair Task Swivel Mesh Chair Adjustable Height US,4755,Brand New,0,False,12
Muddy Swivel Xtreme Swivel Chair with Footrest,10339,Brand New,0,False,7
High-Back Executive PU Leather Office Chair Rolling Ergonomic Swivel Task Chair,9439,Brand New,999,False,59
Ergonomic Office Desk Chair Height Adjustable Armless Fabric Computer Task,6999,Brand New,0,True,
Office Leather Ergonomic Executive Desk Chair Swivel Computer Chair Gaming Chair,7999,Brand New,1999,False,
"Mainstays Mesh Task Chair with Plush Padded Seat, Black, Multiple Color NEW",3099,Brand New,0,False,
Hidal Brown Fabric Glider Recliner Club Chair,24999,Brand New,0,False,
Black[GLADIATOR]Mesh Game Racing Chair Home Office Computer Desk Seat w/Headrest,8599,Brand New,0,True,
Gaming Chair Office Ergonomic Racing High Back Computer Seat Swivel Adjustable,11499,Brand New,0,False,
"Contemporary Fabric Pushback Recliner, Navy Blue",16499,Brand New,0,False,
Seat Foam Replacement for Herman Miller Aeron Office Chair Size A/B Or Size C,945,Brand New,0,False,1564
Computer Gaming Chair High Back Swivel Executive Racing Style Chair Recliner,7899,Brand New,0,True,
"2-Pack Tommy Bahama Beach Chair Lay Flat, Reclining, Adjustable, Storage, NEW",8164,Brand New,0,True,64
Deluxe Padded Recliner Comfort Coils Lazy Boy Chair Comfy Comfortable Seat,23999,Brand New,0,True,
Midback Executive Modern Office Chair Computer Desk Task PU Leather Swivel,9799,Brand New,0,False,
Mesh Office Desk Computer Chair Adjustable Stool Back Support Rolling Swivel,5129,Brand New,0,True,
Adjustable Office Executive Desk Chair Ergonomic Swivel Conference Chair Leather,5899,Brand New,0,False,
"Massage PU Leather Lounge Living Room Recliner Chair w/ Remote, Footrest, Black",27099,Brand New,0,False,51
New ListingYSSOA 2-Pack Office Guest Chair with Lumbar Support & Mid Back Mesh Grid Chairs,8599,Brand New,0,True,
"New ListingGTWD-200 Gaming Chair with Footrest, Adjustable Height, and Reclining, Red",12900,Brand New,0,False,
"Mainstays Fabric Folding Butterfly Chair, Multiple Colors",2899,Brand New,0,False,
Herman Miller Mirra Chair w/Fully Adjustable Features - Graphite Frame,45999,Refurbished,0,False,
Big & Tall High Back Executive Office Chair Leather Computer Desk Recliner Chair,15299,Brand New,0,True,
New ListingShuanghu LR103 F Gaming Chair Black/White,2050,New – Open box,0,False,
Stretch Plush Thick Sofa Covers 1 2 3 4 Seater Couch Chair Slipcover Protector,1990,Brand New,0,False,
Hoffree Massage Gaming Chair RGB LED Lights Recliner Racing Chair with Footrest,12599,Brand New,0,True,
Home Office Chair Ergonomic Desk Chair Mesh Computer Chair with Lumbar Support,5298,Brand New,0,False,
Office Chair Gas Lift Cylinder Replacement Pneumatic Hydraulic Piston Heavy Duty,1688,Brand New,0,False,
Big And Tall 400lb Office Chair Ergonomic Executive Desk Chair with Lumbar,16999,Brand New,0,False,129
Video Gaming Racing Chair Ergonomic Swivel Leather Computer Desk Office Chair,8399,Brand New,0,False,6
"Herman Miller Aeron Remastered Chair - Size C, - open box - Mineral ",99911,New – Open box,0,True,32
Mesh Home Office Task Chair Plush Padded Seat Adjustable Height Swivel High Back,3949,Brand New,0,True,
48Pcs Ruby Slider Chair Leg Protector For Hardwood Floors Fits All Shape Chair,487,Brand New,0,False,
Mini Portable Folding Chair Outdoor Camping Fishing Picnic Beach Stool Seat NEW,1297,Brand New,0,True,662
"X Rocker Play 2.0 Floor Rocker Gaming Chair, Black",4899,Brand New,0,True,
Salduro Sculptural Wood Dining Chair with Upholstered Seat Linen - Threshold,5699,Open Box,0,True,6
Herman Miller Aeron Office Chair Arm Pads Caps NEW SOFTER VERSION (1 Pair),2250,Brand New,0,False,
Mesh Chair Home Office Chair Swivel Mid Back Ergonomic Computer Task Desk Seat,5989,Brand New,0,False,
Gymax Massage Sofa Gaming Recliner Chair Racing Single Lounge Chair Home Theater,16949,Brand New,0,False,
Aeron Chair by Herman Miller Size B with Polished Aluminum Base open box,99911,New – Open box,0,True,30
Adjustable bentwood Ergonomic Kneeling Chair Stool Strengthen Muscles Furniture,6299,Brand New,0,True,
Kneeling Chair Home Office Ergonomic Computer Desk Wood Stool For Active Sitting,7759,Brand New,0,True,
Mid Back Office Computer Desk Chair Ergonomic PU Leather Swivel Executive Chair,7792,Brand New,0,False,
Big and Tall Heavy Duty Executive Chair 500lbs Wide Seat Massage Office Chair,19774,Brand New,0,False,
Atlas The Best Headrest for the Herman Miller Aeron Chair - Graphite Remastered,18999,Brand New,0,False,
High Back Office Chair Black PU Soft Leather Executive Ergonomic Computer Desk,10999,Brand New,0,True,792
Ergonomic Gaming Chair Computer Swivel Executive Office Desk Chair Recliner ,10999,Brand New,0,True,
Haworth Zody Office Chair Arm Pads Caps Replacement NEW VERSION (1 PAIR),2250,Brand New,0,False,
HighBack Mesh Office Chair Ergonomic Swivel Computer Desk Mesh Office Chair,9999,Brand New,0,False,
Razer Iskur Gaming Chair with Lumbar Support - Black Certified Refurbished,39999,Certified - Refurbished,0,True,
5Pcs 3 Inch Heavy Duty Office Chair Caster PU Swivel  Wheels Replacement US,1781,Brand New,0,False,377
8 Modes Full Body Massager Cushion Back Seat Chair Car Pad Heat Mat Home Office,3724,Brand New,0,False,
Alfred Contemporary Deep Button Tufted Fabric Club Chair with Nailhead Accents,14169,Brand New,0,False,
Ergonomic Office Gaming Chair Computer Racing Lumbar Massage Recliner Swivel PU,10999,Brand New,0,False,
"Plastic Nesting Stack Stools - School/Office/Home, 17.5""Height (5 Pack)",8399,Brand New,0,False,7
Gaming Chair Racing Style High Back Office Computer Desk Seat Recliner Vibration,11999,Brand New,0,True,
Razer Iskur X Ergonomic Gaming Chair Black / Green,39900,Brand New,0,False,13
Big and Tall 500lbs Wide Seat Ergonomic Massage Chair Office Computer Desk Chair,19774,Brand New,0,False,
Waiting Room Office Desk Side Chairs Black Leather Guest Chair Reception ,5259,Brand New,1999,True,
New ListingHerman Miller X Logitech G Embody Gaming Chair -  Black and Cyan Brand NEW,160000,Brand New,0,False,
Brand New Arm Pads Caps Replacement For Haworth Zody Office Chair Black 1 Pair,2599,Brand New,0,False,2074
"New ListingGaming Office Chair with Faux Leather, Green",6799,Brand New,0,True,
Ergonomic Gaming Racing Chair Leather Computer Executive Office Desk Seat Swivel,7999,Brand New,0,True,
Herman Miller Aeron Chair Back Size B,2500,Pre-Owned,2580,False,
Mind Reader Ergonomic Rolling Office Chair Silver,5000,Brand New,0,False,
Patio Chair Cover Waterproof Outdoor Lounge Stackable High-Back Chairs Covers US,969,Brand New,125,True,
"Mid-Back, Vinyl Mesh Task Office Chair, Gray",3699,Brand New,0,False,
CLATINA Office Reception Guest Chair Bonded Leather Padded Armrest Conference,7399,Brand New,0,True,34
" Vinyl Folding Chair (4 Pack), Black",6299,Brand New,0,False,
Rolling Executive  Leather Office Desk Chair High Back Swivel Conference Chair,11299,Brand New,0,False,79
Faux Leather Task Office Chair Swivel Ergonomic Computer Desk Chair with T-Arms,3999,Brand New,0,False,
Sandra Mid Century Modern Dining Chairs (Set of 2),16331,Brand New,0,False,
"Pink Gaming Chair for Kids, Gamer Chair for Teens Adults Computer Chair",9900,Brand New,2000,False,
Ergonomic Computer Gaming Chair with Footrest Lumbar Massage Support,10999,Brand New,0,True,89
Adjustable Work Stool Tall Rolling Desk Chair Swivel Shop Height Garage Seat,3880,Brand New,0,False,18
Office Ergomomic Heated Vibrating Massage Chair PU Leather  Swivel Computer Seat,15599,Brand New,0,False,140
2/4PCS  Modern Square PU Leather Adjustable Bar Stools with Back Swivel Stool ,8758,Brand New,0,True,
Herman Miller Classic Aeron Chair  Seat Height Button/Knob,1099,Brand New,0,True,112
BC106 Barronett Blinds 360 Swivel Tripod Ground Blind Hunting Chair OPEN BOX,8900,Brand New,0,False,
"High Back Video Gaming Chair Ergonomic Task Swivel Chair Mesh Back, Leather Seat",5599,Brand New,0,False,52
High Back Leather Office Chair Executive Office Desk Task Computer Chair ,6999,Brand New,0,False,
Foldable Home Office Mesh Chair Swivel Computer Desk Task Chair Flip-up Armrests,9899,Brand New,0,False,
Xtreme Comforts Foam Coccyx Tailbone Cushion Orthopedic Non-Slip Chair Pillow US,1699,Brand New,0,False,84
Black PU Leather High Back Office Chair Executive Ergonomic Computer Desk Swivel,10799,Brand New,0,True,374
KLASIKA High Back Leather Office Chair Executive Office Desk Task Computer Chair,9599,Brand New,0,True,
NEW Lumbar Back Support Pad Size B For Herman Miller Classic Aeron Chair Black,2294,Brand New,0,False,1327
Swivel Xtreme Swivel Chair with Footrest,9493,Brand New,0,False,18
"SERTA TASK CHAIR, CHOOSE COLOR *DISTRESSED PKG",7999,New – Open box,0,False,6
Zody Office Chair by Haworth - Highly Adjustable - Made in USA ,29999,Refurbished,0,False,52
Humanscale Freedom Chair Armrests Replacements,8000,New – Open box,0,False,
